{
  "version": "1.1.0",
  "protocols": [
    {
      "id": "audit-policy",
      "path": "meta/governance/protocols/audit-policy.json",
      "authority": "meta/governance/protocols/audit-policy.json",
      "version": "1.0.0",
      "layer": 3,
      "scope": "governance",
      "canonical": true,
      "lifecycle_status": "active",
      "dependencies": [
        "execution-lifecycle",
        "self-healing"
      ],
      "supersedes": [],
      "superseded_by": null,
      "reflection_path": null,
      "validator_path": null
    },
    {
      "id": "checkpoint",
      "path": "meta/governance/protocols/checkpoint.json",
      "authority": "meta/governance/protocols/checkpoint.json",
      "version": "1.0.0",
      "layer": 2,
      "scope": "recovery",
      "canonical": true,
      "lifecycle_status": "active",
      "dependencies": [
        "runtime-governance-kernel",
        "CANONICAL_AUTHORITY_HIERARCHY",
        "execution-lifecycle"
      ],
      "supersedes": [],
      "superseded_by": null,
      "reflection_path": "project-governance/protocols/checkpoint.protocol.md",
      "validator_path": "scripts/validators/protocol-checkpoint.ts"
    },
    {
      "id": "deployment-readiness",
      "path": "meta/governance/protocols/deployment-readiness.json",
      "authority": "meta/governance/protocols/deployment-readiness.json",
      "version": "1.0.0",
      "layer": 3,
      "scope": "governance",
      "canonical": true,
      "lifecycle_status": "active",
      "dependencies": [],
      "supersedes": [],
      "superseded_by": null,
      "reflection_path": null,
      "validator_path": null
    },
    {
      "id": "drift-recovery",
      "path": "meta/governance/protocols/drift-recovery.json",
      "authority": "meta/governance/protocols/drift-recovery.json",
      "version": "1.0.0",
      "layer": 2,
      "scope": "recovery",
      "canonical": false,
      "lifecycle_status": "superseded",
      "dependencies": [
        "runtime-governance-kernel",
        "CANONICAL_AUTHORITY_HIERARCHY"
      ],
      "supersedes": [],
      "superseded_by": "drift-classification",
      "reflection_path": null,
      "validator_path": null
    },
    {
      "id": "enforcement-policy",
      "path": "meta/governance/protocols/enforcement-policy.json",
      "authority": "meta/governance/protocols/enforcement-policy.json",
      "version": "1.0.0",
      "layer": 3,
      "scope": "governance",
      "canonical": true,
      "lifecycle_status": "active",
      "dependencies": [
        "execution-state-machine",
        "execution-lifecycle"
      ],
      "supersedes": [],
      "superseded_by": null,
      "reflection_path": null,
      "validator_path": "scripts/validators/protocol-enforcement-policy.ts"
    },
    {
      "id": "execution-authorization",
      "path": "meta/governance/protocols/execution-authorization.json",
      "authority": "meta/governance/protocols/execution-authorization.json",
      "version": "1.0.0",
      "layer": 2,
      "scope": "authorization",
      "canonical": true,
      "lifecycle_status": "active",
      "dependencies": [
        "runtime-governance-kernel",
        "CANONICAL_AUTHORITY_HIERARCHY"
      ],
      "supersedes": [],
      "superseded_by": null,
      "reflection_path": null,
      "validator_path": null
    },
    {
      "id": "execution-lifecycle",
      "path": "meta/governance/protocols/execution-lifecycle.json",
      "authority": "meta/governance/protocols/execution-lifecycle.json",
      "version": "1.0.0",
      "layer": 2,
      "scope": "execution",
      "canonical": true,
      "lifecycle_status": "active",
      "dependencies": [
        "runtime-governance-kernel",
        "CANONICAL_AUTHORITY_HIERARCHY"
      ],
      "supersedes": [],
      "superseded_by": null,
      "reflection_path": "project-governance/protocols/execution-lifecycle.protocol.md",
      "validator_path": "scripts/validators/protocol-execution-lifecycle.ts"
    },
    {
      "id": "execution-state-machine",
      "path": "meta/governance/protocols/execution-state-machine.json",
      "authority": "meta/governance/protocols/execution-state-machine.json",
      "version": "1.0.0",
      "layer": 2,
      "scope": "execution",
      "canonical": true,
      "lifecycle_status": "active",
      "dependencies": [],
      "supersedes": [],
      "superseded_by": null,
      "reflection_path": null,
      "validator_path": "scripts/validators/protocol-execution-state-machine.ts"
    },
    {
      "id": "retention-policy",
      "path": "meta/governance/protocols/retention-policy.json",
      "authority": "meta/governance/protocols/retention-policy.json",
      "version": "1.0.0",
      "layer": 3,
      "scope": "governance",
      "canonical": true,
      "lifecycle_status": "active",
      "dependencies": [
        "execution-lifecycle"
      ],
      "supersedes": [],
      "superseded_by": null,
      "reflection_path": null,
      "validator_path": null
    },
    {
      "id": "self-healing",
      "path": "meta/governance/protocols/self-healing.json",
      "authority": "meta/governance/protocols/self-healing.json",
      "version": "1.0.0",
      "layer": 3,
      "scope": "recovery",
      "canonical": true,
      "lifecycle_status": "active",
      "dependencies": [
        "execution-lifecycle",
        "drift-recovery"
      ],
      "supersedes": [],
      "superseded_by": null,
      "reflection_path": null,
      "validator_path": null
    },
    {
      "id": "state-mutation",
      "path": "meta/governance/protocols/state-mutation.json",
      "authority": "meta/governance/protocols/state-mutation.json",
      "version": "1.0.0",
      "layer": 2,
      "scope": "state",
      "canonical": true,
      "lifecycle_status": "active",
      "dependencies": [
        "runtime-governance-kernel",
        "CANONICAL_AUTHORITY_HIERARCHY",
        "execution-lifecycle"
      ],
      "supersedes": [],
      "superseded_by": null,
      "reflection_path": "project-governance/protocols/state-mutation.protocol.md",
      "validator_path": "scripts/validators/protocol-state-mutation.ts"
    },
    {
      "id": "operational-mode",
      "path": "meta/governance/protocols/operational-mode.json",
      "authority": "meta/governance/protocols/operational-mode.json",
      "version": "1.0.0",
      "layer": 2,
      "scope": "execution",
      "canonical": true,
      "lifecycle_status": "active",
      "dependencies": [
        "runtime-governance-kernel",
        "CANONICAL_AUTHORITY_HIERARCHY"
      ],
      "supersedes": [],
      "superseded_by": null,
      "reflection_path": null,
      "validator_path": null
    },
    {
      "id": "execution-freeze",
      "path": "meta/governance/protocols/execution-freeze.json",
      "authority": "meta/governance/protocols/execution-freeze.json",
      "version": "1.0.0",
      "layer": 2,
      "scope": "execution",
      "canonical": true,
      "lifecycle_status": "active",
      "dependencies": [
        "runtime-governance-kernel",
        "operational-mode",
        "execution-lifecycle"
      ],
      "supersedes": [],
      "superseded_by": null,
      "reflection_path": null,
      "validator_path": null
    },
    {
      "id": "authority-reconstruction",
      "path": "meta/governance/protocols/authority-reconstruction.json",
      "authority": "meta/governance/protocols/authority-reconstruction.json",
      "version": "1.0.0",
      "layer": 2,
      "scope": "recovery",
      "canonical": true,
      "lifecycle_status": "active",
      "dependencies": [
        "runtime-governance-kernel",
        "checkpoint",
        "execution-lifecycle"
      ],
      "supersedes": [],
      "superseded_by": null,
      "reflection_path": null,
      "validator_path": null
    },
    {
      "id": "drift-classification",
      "path": "meta/governance/protocols/drift-classification.json",
      "authority": "meta/governance/protocols/drift-classification.json",
      "version": "1.0.0",
      "layer": 2,
      "scope": "recovery",
      "canonical": true,
      "lifecycle_status": "active",
      "dependencies": [
        "runtime-governance-kernel",
        "authority-reconstruction",
        "operational-mode"
      ],
      "supersedes": [
        "drift-recovery"
      ],
      "superseded_by": null,
      "reflection_path": null,
      "validator_path": null
    },
    {
      "id": "repair-contract",
      "path": "meta/governance/protocols/repair-contract.json",
      "authority": "meta/governance/protocols/repair-contract.json",
      "version": "1.0.0",
      "layer": 2,
      "scope": "recovery",
      "canonical": true,
      "lifecycle_status": "active",
      "dependencies": [
        "runtime-governance-kernel",
        "authority-reconstruction",
        "drift-classification",
        "execution-freeze"
      ],
      "supersedes": [],
      "superseded_by": null,
      "reflection_path": null,
      "validator_path": null
    },
    {
      "id": "integrity-validation",
      "path": "meta/governance/protocols/integrity-validation.json",
      "authority": "meta/governance/protocols/integrity-validation.json",
      "version": "1.0.0",
      "layer": 2,
      "scope": "recovery",
      "canonical": true,
      "lifecycle_status": "active",
      "dependencies": [
        "runtime-governance-kernel",
        "authority-reconstruction",
        "repair-contract",
        "execution-freeze"
      ],
      "supersedes": [],
      "superseded_by": null,
      "reflection_path": null,
      "validator_path": null
    },
    {
      "id": "invariant-policy",
      "path": "meta/governance/protocols/invariant-policy.json",
      "authority": "meta/governance/protocols/invariant-policy.json",
      "version": "1.0.0",
      "layer": 2,
      "scope": "governance",
      "canonical": true,
      "lifecycle_status": "active",
      "dependencies": [
        "runtime-governance-kernel",